{
  "id": "DRC-FX-004",
  "revision": 1,
  "result": "PERMITTED",
  "gtaf_ref": {
    "version": "0.1"
  },
  "scope": "ops.prod",
  "valid_from": "2026-01-01T00:00:00Z",
  "valid_until": "2026-12-31T00:00:00Z",
  "refs": {
    "sb": ["SB-FX-004"],
    "dr": ["DR-FX-004"],
    "rb": ["RB-FX-004"]
  }
}
